{
  "action_id": "a1b2c3",
  "agent": "cost-optimizer",
  "action_type": "resize_instance",
  "resource_id": "i-123",
  "resource_type": "ec2",
  "proposed_change": {
    "from": "t3.large",
    "to": "t3.medium"
  },
  "estimated_monthly_savings_usd": 25.0,
  "risk_score": 0.2,
  "confidence": 0.9,
  "created_at": "2026-02-01T03:00:00Z"
}
